{
  "schemaVersion": 2,
  "requiredSetId": "fable5-v2",
  "waveId": "A",
  "category": "overlay",
  "assetCount": 17,
  "assets": [
    {
      "id": "overlay.flowers.a",
      "category": "overlay",
      "artDirection": {
        "version": 2,
        "subjectForm": "Low patch of five cream daisies among round leaves",
        "materials": [
          "cream daisy petals",
          "yellow disk florets",
          "round green leaves"
        ],
        "dominantColors": [
          "ivory cream",
          "leaf green"
        ],
        "accentColors": [
          "mustard-yellow centers",
          "blue-green leaf shadows"
        ],
        "shapeLanguage": "Asymmetrical clusters with broken repetition and transparent breathing room. Defining contour: Two blossoms face up and three tilt toward the key light",
        "distinguishingFeatures": [
          "Two blossoms face up and three tilt toward the key light",
          "The cluster spreads left-heavy with visible soil gaps"
        ],
        "distinguishFrom": [
          {
            "assetId": "overlay.flowers.b",
            "reason": "A uses low cream daisies; B uses tall blue bells"
          }
        ],
        "composition": "One isolated overlay at native scale with no baked neighboring asset. Exact subject: Low patch of five cream daisies among round leaves",
        "groundContact": "Five stems terminate in tiny dark-soil pixels at the ground baseline; petals and leaves rise from that one left-heavy rooted cluster.",
        "negativeConstraints": [
          "Do not borrow overlay.flowers.b's form: A uses low cream daisies; B uses tall blue bells",
          "Do not omit or contradict this cue: The cluster spreads left-heavy with visible soil gaps"
        ],
        "frameContent": [
          {
            "frameId": "primary",
            "visualContent": "Low patch of five cream daisies among round leaves; one complete isolated primary sprite showing two blossoms face up and three tilt toward the key light."
          }
        ]
      }
    },
    {
      "id": "overlay.flowers.b",
      "category": "overlay",
      "artDirection": {
        "version": 2,
        "subjectForm": "Three tall bluebell stems with drooping violet cups",
        "materials": [
          "violet-blue bell petals",
          "slender green stems",
          "lance-shaped leaves"
        ],
        "dominantColors": [
          "indigo blue",
          "cool leaf green"
        ],
        "accentColors": [
          "lavender petal rims",
          "deep teal stem shadows"
        ],
        "shapeLanguage": "Asymmetrical clusters with broken repetition and transparent breathing room. Defining contour: Stems step upward from left to right",
        "distinguishingFeatures": [
          "Stems step upward from left to right",
          "Narrow leaves form a vertical harbor-side silhouette"
        ],
        "distinguishFrom": [
          {
            "assetId": "overlay.flowers.a",
            "reason": "B is tall and blue; A is low and cream-colored"
          }
        ],
        "composition": "One isolated overlay at native scale with no baked neighboring asset. Exact subject: Three tall bluebell stems with drooping violet cups",
        "groundContact": "Three stems meet a narrow soil contact at the lower center; drooping cups remain above the baseline and cast no detached shadow.",
        "negativeConstraints": [
          "Do not borrow overlay.flowers.a's form: B is tall and blue; A is low and cream-colored",
          "Do not omit or contradict this cue: Narrow leaves form a vertical harbor-side silhouette"
        ],
        "frameContent": [
          {
            "frameId": "primary",
            "visualContent": "Three tall bluebell stems with drooping violet cups; one complete isolated primary sprite showing stems step upward from left to right."
          }
        ]
      }
    },
    {
      "id": "overlay.flowers.c",
      "category": "overlay",
      "artDirection": {
        "version": 2,
        "subjectForm": "Loose woodland cluster of rust-red stars and fern tips",
        "materials": [
          "rust-red star petals",
          "fern fronds",
          "dark woodland soil"
        ],
        "dominantColors": [
          "brick red",
          "fern green"
        ],
        "accentColors": [
          "ochre flower centers",
          "cool pine-green shadows"
        ],
        "shapeLanguage": "Asymmetrical clusters with broken repetition and transparent breathing room. Defining contour: One large star bloom anchors the lower-right",
        "distinguishingFeatures": [
          "One large star bloom anchors the lower-right",
          "Fern fronds form an open crescent around smaller blooms"
        ],
        "distinguishFrom": [
          {
            "assetId": "overlay.flowers.a",
            "reason": "C uses red stars and fern; A uses round daisies"
          }
        ],
        "composition": "One isolated overlay at native scale with no baked neighboring asset. Exact subject: Loose woodland cluster of rust-red stars and fern tips",
        "groundContact": "Fern stems and star-flower stalks converge on an open crescent of dark soil pixels, leaving transparent gaps between rooted clumps.",
        "negativeConstraints": [
          "Do not borrow overlay.flowers.a's form: C uses red stars and fern; A uses round daisies",
          "Do not omit or contradict this cue: Fern fronds form an open crescent around smaller blooms"
        ],
        "frameContent": [
          {
            "frameId": "primary",
            "visualContent": "Loose woodland cluster of rust-red stars and fern tips; one complete isolated primary sprite showing one large star bloom anchors the lower-right."
          }
        ]
      }
    },
    {
      "id": "overlay.pebbles.a",
      "category": "overlay",
      "artDirection": {
        "version": 2,
        "subjectForm": "Flat trio of warm river pebbles with one chipped edge",
        "materials": [
          "river-polished sandstone",
          "small quartz pebble"
        ],
        "dominantColors": [
          "warm tan stone",
          "muted brown undersides"
        ],
        "accentColors": [
          "cream quartz fleck",
          "cool gray contact rim"
        ],
        "shapeLanguage": "Asymmetrical clusters with broken repetition and transparent breathing room. Defining contour: Largest oval sits low with two stones offset north-east",
        "distinguishingFeatures": [
          "Largest oval sits low with two stones offset north-east",
          "Warm faces carry narrow cool contact rims"
        ],
        "distinguishFrom": [
          {
            "assetId": "overlay.pebbles.b",
            "reason": "A is smooth warm river stone; B is angular gray scree"
          }
        ],
        "composition": "One isolated overlay at native scale with no baked neighboring asset. Exact subject: Flat trio of warm river pebbles with one chipped edge",
        "groundContact": "All three flattened stones touch one tight shared ground ellipse; the largest oval sits lowest with no shadow gap beneath its front edge.",
        "negativeConstraints": [
          "Do not borrow overlay.pebbles.b's form: A is smooth warm river stone; B is angular gray scree",
          "Do not omit or contradict this cue: Warm faces carry narrow cool contact rims"
        ],
        "frameContent": [
          {
            "frameId": "primary",
            "visualContent": "Flat trio of warm river pebbles with one chipped edge; one complete isolated primary sprite showing largest oval sits low with two stones offset north-east."
          }
        ]
      }
    },
    {
      "id": "overlay.pebbles.b",
      "category": "overlay",
      "artDirection": {
        "version": 2,
        "subjectForm": "Angular gray scree cluster of four slate fragments",
        "materials": [
          "split slate shards",
          "fine gray scree"
        ],
        "dominantColors": [
          "charcoal slate",
          "blue-gray fracture planes"
        ],
        "accentColors": [
          "snow-blue chipped edges",
          "deep violet crevices"
        ],
        "shapeLanguage": "Asymmetrical clusters with broken repetition and transparent breathing room. Defining contour: Two shards overlap along a broken diagonal",
        "distinguishingFeatures": [
          "Two shards overlap along a broken diagonal",
          "Snow-blue highlights expose split stone planes"
        ],
        "distinguishFrom": [
          {
            "assetId": "overlay.pebbles.a",
            "reason": "B has sharp slate fragments; A has smooth tan ovals"
          }
        ],
        "composition": "One isolated overlay at native scale with no baked neighboring asset. Exact subject: Angular gray scree cluster of four slate fragments",
        "groundContact": "Four angular shards rest on their lowest facets along a broken diagonal, with contact pixels directly beneath each overlapping piece.",
        "negativeConstraints": [
          "Do not borrow overlay.pebbles.a's form: B has sharp slate fragments; A has smooth tan ovals",
          "Do not omit or contradict this cue: Snow-blue highlights expose split stone planes"
        ],
        "frameContent": [
          {
            "frameId": "primary",
            "visualContent": "Angular gray scree cluster of four slate fragments; one complete isolated primary sprite showing two shards overlap along a broken diagonal."
          }
        ]
      }
    },
    {
      "id": "overlay.pebbles.c",
      "category": "overlay",
      "artDirection": {
        "version": 2,
        "subjectForm": "Salt-pale beach shingle arc with one dark wet stone",
        "materials": [
          "salt-bleached beach shingle",
          "single wet basalt pebble"
        ],
        "dominantColors": [
          "chalk beige",
          "wet charcoal"
        ],